{
  "schemaVersion": 1,
  "logicalVersion": "v1.16.1",
  "dataset": "effects",
  "generator": "tools/migration/canonical_data.py",
  "sources": [
    {
      "path": "game/data/effect_contracts.json",
      "sha256": "bc3e142e5085d9cb37bd7e6e71e075bf73d1bba77f377b3d3b2ff69a1d4ffdc3",
      "normalization": "utf8_lf"
    },
    {
      "path": "legacy/web-prototype/data/legacy_deck_source.json",
      "sha256": "147a4c37569e9f1b5b3fad344ea2d80167ba119adc9338e69b619a3688d26c98",
      "normalization": "utf8_lf"
    }
  ],
  "records": [
    {
      "id": "legacy_001",
      "cardId": "legacy_001",
      "profile": "base_text_v1",
      "lifecycle": "unreviewed",
      "parity": "unresolved",
      "reason": "Exact semantics not reviewed; JS branch/keyword effects are not canonical.",
      "originalTextSha256": "a49c9a16230a36fd76d6573920dba2636481ec43d5c6c389f941472c22469f96",
      "rules": [],
      "provenance": {
        "source": "legacy/web-prototype/data/legacy_deck_source.json",
        "pointer": "/0/effect",
        "sourceSha256": "147a4c37569e9f1b5b3fad344ea2d80167ba119adc9338e69b619a3688d26c98"
      },
      "specification": "docs/architecture/ADR-0003-canonical-data-and-effect-contracts.md",
      "tests": "game/tests/effect_test.gd",
      "executionCoverage": "rejection_only"
    },
    {
      "id": "legacy_002",
      "cardId": "legacy_002",
      "profile": "base_text_v1",
      "lifecycle": "implemented",
      "parity": "legacy approximation",
      "reason": "Add 5 base-damage units once at combat start.",
      "originalTextSha256": "53802bf8b7326075e65f2002b20939367c9decd830e72a7a622116a9bcc4672b",
      "rules": [
        {
          "trigger": "combat_start",
          "chance_bp": 10000,
          "interval_ms": 0,
          "loss_threshold_milli": 0,
          "condition": {
            "kind": "always",
            "value": ""
          },
          "actions": [
            {
              "type": "modify_stat",
              "target": "self",
              "amount": 5000,
              "unit": "milli",
              "field": "base_damage_milli",
              "formula": "flat",
              "factor_bp": 0,
              "minimum": 0,
              "cap": 0,
              "damage_kind": "none",
              "handler": ""
            }
          ]
        }
      ],
      "provenance": {
        "source": "game/data/effect_contracts.json",
        "pointer": "/pilots/0",
        "sourceSha256": "bc3e142e5085d9cb37bd7e6e71e075bf73d1bba77f377b3d3b2ff69a1d4ffdc3"
      },
      "specification": "docs/architecture/ADR-0003-canonical-data-and-effect-contracts.md",
      "tests": "game/tests/effect_test.gd",
      "executionCoverage": "base_text_contract"
    },
    {
      "id": "legacy_003",
      "cardId": "legacy_003",
      "profile": "base_text_v1",
      "lifecycle": "unreviewed",
      "parity": "unresolved",
      "reason": "Exact semantics not reviewed; JS branch/keyword effects are not canonical.",
      "originalTextSha256": "8a35da6069de22b44e9ffb81e4dc2d0102725fc9223985d1fa72fd6508a8cfdf",
      "rules": [],
      "provenance": {
        "source": "legacy/web-prototype/data/legacy_deck_source.json",
        "pointer": "/2/effect",
        "sourceSha256": "147a4c37569e9f1b5b3fad344ea2d80167ba119adc9338e69b619a3688d26c98"
      },
      "specification": "docs/architecture/ADR-0003-canonical-data-and-effect-contracts.md",
      "tests": "game/tests/effect_test.gd",
      "executionCoverage": "rejection_only"
    },
    {
      "id": "legacy_004",
      "cardId": "legacy_004",
      "profile": "base_text_v1",
      "lifecycle": "unreviewed",
      "parity": "unresolved",
      "reason": "Exact semantics not reviewed; JS branch/keyword effects are not canonical.",
      "originalTextSha256": "aabcb45c1322669d9bb9f01ba6c24e65ed93760845469c11c55e32fa94c6905a",
      "rules": [],
      "provenance": {
        "source": "legacy/web-prototype/data/legacy_deck_source.json",
        "pointer": "/3/effect",
        "sourceSha256": "147a4c37569e9f1b5b3fad344ea2d80167ba119adc9338e69b619a3688d26c98"
      },
      "specification": "docs/architecture/ADR-0003-canonical-data-and-effect-contracts.md",
      "tests": "game/tests/effect_test.gd",
      "executionCoverage": "rejection_only"
    },
    {
      "id": "legacy_005",
      "cardId": "legacy_005",
      "profile": "base_text_v1",
      "lifecycle": "implemented",
      "parity": "legacy approximation",
      "reason": "On each basic_attack, 6000 bp chance to gain 1500 milli-energy.",
      "originalTextSha256": "2e0d6b721088c50cbb3d585bea18543b853e851ba913312093e45e6c4385f663",
      "rules": [
        {
          "trigger": "basic_attack",
          "chance_bp": 6000,
          "interval_ms": 0,
          "loss_threshold_milli": 0,
          "condition": {
            "kind": "always",
            "value": ""
          },
          "actions": [
            {
              "type": "gain_energy",
              "target": "self",
              "amount": 1500,
              "unit": "milli",
              "field": "",
              "formula": "flat",
              "factor_bp": 0,
              "minimum": 0,
              "cap": 0,
              "damage_kind": "none",
              "handler": ""
            }
          ]
        }
      ],
      "provenance": {
        "source": "game/data/effect_contracts.json",
        "pointer": "/pilots/1",
        "sourceSha256": "bc3e142e5085d9cb37bd7e6e71e075bf73d1bba77f377b3d3b2ff69a1d4ffdc3"
      },
      "specification": "docs/architecture/ADR-0003-canonical-data-and-effect-contracts.md",
      "tests": "game/tests/effect_test.gd",
      "executionCoverage": "base_text_contract"
    },
    {
      "id": "legacy_006",
      "cardId": "legacy_006",
      "profile": "base_text_v1",
      "lifecycle": "unreviewed",
      "parity": "unresolved",
      "reason": "Exact semantics not reviewed; JS branch/keyword effects are not canonical.",
      "originalTextSha256": "c8edb387bf88e8b22e27c38fd36a2b7860793ef3722be7c68914a4d80daa408b",
      "rules": [],
      "provenance": {
        "source": "legacy/web-prototype/data/legacy_deck_source.json",
        "pointer": "/5/effect",
        "sourceSha256": "147a4c37569e9f1b5b3fad344ea2d80167ba119adc9338e69b619a3688d26c98"
      },
      "specification": "docs/architecture/ADR-0003-canonical-data-and-effect-contracts.md",
      "tests": "game/tests/effect_test.gd",
      "executionCoverage": "rejection_only"
    },
    {
      "id": "legacy_007",
      "cardId": "legacy_007",
      "profile": "base_text_v1",
      "lifecycle": "unreviewed",
      "parity": "unresolved",
      "reason": "Exact semantics not reviewed; JS branch/keyword effects are not canonical.",
      "originalTextSha256": "2ba5194e2d3ef6314e1da1b4738f6f8b4ff7bc72f8a59262c30173a0f1447586",
      "rules": [],
      "provenance": {
        "source": "legacy/web-prototype/data/legacy_deck_source.json",
        "pointer": "/6/effect",
        "sourceSha256": "147a4c37569e9f1b5b3fad344ea2d80167ba119adc9338e69b619a3688d26c98"
      },
      "specification": "docs/architecture/ADR-0003-canonical-data-and-effect-contracts.md",
      "tests": "game/tests/effect_test.gd",
      "executionCoverage": "rejection_only"
    },
    {
      "id": "legacy_008",
      "cardId": "legacy_008",
      "profile": "base_text_v1",
      "lifecycle": "unreviewed",
      "parity": "unresolved",
      "reason": "Exact semantics not reviewed; JS branch/keyword effects are not canonical.",
      "originalTextSha256": "f3c9f007fd0572212f6d3ee7428690cb2f79708aabc95d01742ad84934dbab9c",
      "rules": [],
      "provenance": {
        "source": "legacy/web-prototype/data/legacy_deck_source.json",
        "pointer": "/7/effect",
        "sourceSha256": "147a4c37569e9f1b5b3fad344ea2d80167ba119adc9338e69b619a3688d26c98"
      },
      "specification": "docs/architecture/ADR-0003-canonical-data-and-effect-contracts.md",
      "tests": "game/tests/effect_test.gd",
      "executionCoverage": "rejection_only"
    },
    {
      "id": "legacy_009",
      "cardId": "legacy_009",
      "profile": "base_text_v1",
      "lifecycle": "unreviewed",
      "parity": "unresolved",
      "reason": "Exact semantics not reviewed; JS branch/keyword effects are not canonical.",
      "originalTextSha256": "4297207171d744b32da72cb36b05ed8ac6b22255d9f77c04d65870f5cef55281",
      "rules": [],
      "provenance": {
        "source": "legacy/web-prototype/data/legacy_deck_source.json",
        "pointer": "/8/effect",
        "sourceSha256": "147a4c37569e9f1b5b3fad344ea2d80167ba119adc9338e69b619a3688d26c98"
      },
      "specification": "docs/architecture/ADR-0003-canonical-data-and-effect-contracts.md",
      "tests": "game/tests/effect_test.gd",
      "executionCoverage": "rejection_only"
    },
    {
      "id": "legacy_010",
      "cardId": "legacy_010",
      "profile": "base_text_v1",
      "lifecycle": "implemented",
      "parity": "legacy approximation",
      "reason": "Each basic_attack adds 400 bp basic damage bonus, capped at 2000 bp per binding.",
      "originalTextSha256": "4baaebd2cf7b6f05f6f58c322c53fda82f51455f47007df3b8c75c8a14ce7794",
      "rules": [
        {
          "trigger": "basic_attack",
          "chance_bp": 10000,
          "interval_ms": 0,
          "loss_threshold_milli": 0,
          "condition": {
            "kind": "always",
            "value": ""
          },
          "actions": [
            {
              "type": "modify_stat",
              "target": "self",
              "amount": 400,
              "unit": "basis_points",
              "field": "basic_damage_bonus_bp",
              "formula": "flat",
              "factor_bp": 0,
              "minimum": 0,
              "cap": 2000,
              "damage_kind": "none",
              "handler": ""
            }
          ]
        }
      ],
      "provenance": {
        "source": "game/data/effect_contracts.json",
        "pointer": "/pilots/2",